,speaker_id,utterance,utt_id,region_id,q_type,target
1187,VLD_se0_ag3_m_03_1.txt,"I'm like, oh we can do exact change, so like, if you pay with the fi-",1530,VLD,q_like_contracted,"I'm like,"
1188,VLD_se0_ag3_m_03_1.txt,"Like, she thought she was gonna get away with it the second go around, the second day. And I said, ma'am,",1551,VLD,q_say,"And I said,"
1189,VLD_se0_ag3_m_03_1.txt,"I said oh yeah, so she's not no nurse? Like nah.",1577,VLD,q_say,I said oh 
1190,VLD_se0_ag3_m_03_1.txt,"And I said, okay.",1581,VLD,q_say,"And I said,"
1191,VLD_se0_ag3_m_03_1.txt,"And I was like, said, man where is nearest gas station here?",1667,VLD,q_like_copula,"And I was like,"
1192,VLD_se0_ag3_m_03_1.txt,"And I said, ooh, the nearest one was on eighty-four.",1669,VLD,q_say,"And I said,"
1193,VLD_se0_ag3_m_03_1.txt,"Called, I said, oh let me just go ahead and call.",1673,VLD,q_say,"I said,"
1194,VLD_se0_ag3_m_03_1.txt,"I said, oh",1692,VLD,q_say,"I said,"
1195,VLD_se0_ag3_m_03_1.txt,"I said, man you ain't even wanna pick up the phone man.",1710,VLD,q_say,"I said,"
1196,VLD_se0_ag3_m_03_1.txt,"I was looking, I said oh she cute.",1754,VLD,q_say,I said oh 
1197,VLD_se0_ag3_m_03_1.txt,"thought that was your husband at the time. I said, oh.",1758,VLD,q_say,"I said,"
1198,VLD_se0_ag3_m_03_1.txt,"we talk about playing cards, and I told him I play poker and he was like, oh okay.",1776,VLD,q_like_copula,"and he was like,"
1199,VLD_se0_ag3_m_03_1.txt,"I said, I wanna learn that trick one day.",2047,VLD,q_say,"I said,"
1200,VLD_se0_ag3_m_03_1.txt,"They looked at it, oh she young. I say, I don't give a darn",2061,VLD,q_say,"I say,"
1201,VLD_se0_ag3_m_03_1.txt,"coulda been there to- to a stop that. I'm like, nah.",2109,VLD,q_like_contracted,"I'm like,"
1202,VLD_se0_ag3_m_03_1.txt,"[<laugh>] And then she ain't wanna by the subpoena her phone records, I say, oh I know she guilty.",2163,VLD,q_say,"I say,"
1203,VLD_se0_ag3_m_03_1.txt,"just to make sure. And I told her this, before I go,",2204,VLD,q_go,"I go,"
1204,VLD_se0_ag3_m_03_1.txt,"I said, whatever you do, don't answer that damn phone. I don't give a damn who it is.",2206,VLD,q_say,"I said,"
1205,VLD_se0_ag3_m_03_1.txt,"I say, well shit. This ain't my damn store. I'm just visiting.",2244,VLD,q_say,"I say,"
1206,VLD_se0_ag3_m_03_1.txt,"So, all I said, that safe situation, that between the girl who call- who closed last night and the opening manager.",2250,VLD,q_say,"I said,"
1207,VLD_se0_ag3_m_03_1.txt,"I say, yeah. Right on.",2278,VLD,q_say,"I say,"
1208,VLD_se0_ag3_m_03_1.txt,"I was like, probably about thirty, forty minutes away from Valdosta.",2297,VLD,q_like_copula,"I was like,"
1209,VLD_se0_ag3_m_03_1.txt,"I mean, I probably want to have a child with a particular person, but she was like uh uh.",2563,VLD,q_like_copula,she was like uh 
1210,VLD_se0_ag3_m_03_1.txt,"I said, even if I was to",2576,VLD,q_say,"I said,"
1211,VLD_se0_ag3_f_01_2.txt,"Scotts well /I think-/ you switching now aren't you? Okay Scotts,",61,VLD,q_think,I think-
1212,VLD_se0_ag3_f_01_2.txt,"me, I'm saying, like where I work at, my boss, like I should be loyal.",89,VLD,q_say,"I'm saying,"
1213,VLD_se0_ag3_f_01_2.txt,"And he says, you can always go back home.",151,VLD,q_say,"And he says,"
1214,VLD_se0_ag3_f_01_2.txt,"And I thought, wow, that's why I kept saying I gotta get involved in the church again, cause I",157,VLD,q_think,"And I thought,"
1215,VLD_se0_ag3_m_01_1.txt,"I think, uh,",381,VLD,q_think,"I think,"
1216,VLD_se0_ag3_m_01_1.txt,"And then- and then one team, we had- we went- we, uh,",865,VLD,q_go,we went-
1217,VLD_se0_ag3_m_01_1.txt,"I was like, ain't no way in the world",881,VLD,q_like_copula,"I was like,"
1218,VLD_se0_ag3_m_01_1.txt,"I was like,",895,VLD,q_like_copula,"I was like,"
1219,VLD_se0_ag4_m_01_1.txt,[I think-] was home. [You know.] So.,642,VLD,q_think,I think-
1220,VLD_se0_ag4_m_01_1.txt,"He told me, he said /RD-NAME-1/, he said, I see you um",1423,VLD,q_say,"he said,"
1221,VLD_se0_ag4_m_01_1.txt,"He told me, he said /RD-NAME-1/, he said, I see you um",1423,VLD,q_tell,"He told me,"
1222,VLD_se0_ag4_m_01_1.txt,"he said he told me, you got to high school? I say yes sir.",1425,VLD,q_tell,"he told me,"
1223,VLD_se0_ag4_m_01_1.txt,"And he said, uh,",1427,VLD,q_say,"And he said,"
1224,VLD_se0_ag4_m_01_1.txt,"He said, but uh,",1435,VLD,q_say,"He said,"
1225,VLD_se0_ag4_m_01_1.txt,"he said, when you get a break,",1439,VLD,q_say,"he said,"
1226,VLD_se0_ag4_m_01_1.txt,"He said, I already instructed these guys,",1443,VLD,q_say,"He said,"
1227,VLD_se0_ag4_m_01_1.txt,"he told me, he said I want you to-",1467,VLD,q_tell,"he told me,"
1228,VLD_se0_ag4_m_01_1.txt,"that- that was remarkable to me. And I often just reflect back on that sometime. I say, I hope you know that-",1485,VLD,q_say,"I say,"
1229,VLD_se0_ag4_m_01_1.txt,"they say, well,",1915,VLD,q_say,"they say,"
1230,VLD_se0_ag4_m_01_1.txt,"And I said, well I-",1971,VLD,q_say,"And I said,"
1231,VLD_se0_ag4_m_01_1.txt,"And he said, you'll swap with me? And I said, uh,",1979,VLD,q_say,"And he said,"
1231,VLD_se0_ag4_m_01_1.txt,"And he said, you'll swap with me? And I said, uh,",1979,VLD,q_say,"And I said,"
1232,VLD_se0_ag4_m_01_1.txt,"He said,",2584,VLD,q_say,"He said,"
1233,VLD_se0_ag4_m_01_1.txt,"when I got my car, he said,",2588,VLD,q_say,"he said,"
1234,VLD_se0_ag4_m_01_1.txt,"He said, see that door over there? I say, yes sir.",2592,VLD,q_say,"He said,"
1234,VLD_se0_ag4_m_01_1.txt,"He said, see that door over there? I say, yes sir.",2592,VLD,q_say,"I say,"
1235,VLD_se0_ag4_m_01_1.txt,"He said, lemme give you an illustration. He said, in the wild, wild west,",2598,VLD,q_say,"He said,"
1235,VLD_se0_ag4_m_01_1.txt,"He said, lemme give you an illustration. He said, in the wild, wild west,",2598,VLD,q_say,"He said,"
1236,VLD_se0_ag4_m_01_1.txt,"He said, now you don't-",2612,VLD,q_say,"He said,"
1237,VLD_se0_ag4_m_01_1.txt,"So, I met him and he said, man I'm gonna introduce you to my mom and my um,",2687,VLD,q_say,"and he said,"
1238,VLD_se0_ag4_m_01_1.txt,"and she always told me, she said, you're always welcome,",2708,VLD,q_say,"she said,"
1239,VLD_se0_ag4_m_01_1.txt,"She said,",3476,VLD,q_say,"She said,"
1240,VLD_se0_ag4_f_01_1.txt,"that my aunt had hung herself and I'm thinking,",222,VLD,q_think,"and I'm thinking,"
1241,VLD_se0_ag4_f_01_1.txt,"pass by, and I'm thinking, oh, they got her on this trash truck.",230,VLD,q_think,"and I'm thinking,"
1242,VLD_se0_ag4_f_01_1.txt,"I was like, only, um,",726,VLD,q_like_copula,"I was like,"
1243,VLD_se0_ag4_f_01_1.txt,"inspired me. She said, I don't know, you say you are smart. Why don't you go- go to school. And she kept every",990,VLD,q_say,"She said,"
1244,VLD_se0_ag4_f_01_1.txt,"Oh, she was just a doll. I wanted a little girl. I said, ooh can I have your little girl?",1056,VLD,q_say,"I said,"
1245,VLD_se0_ag4_f_01_1.txt,"We go, she go too.",1186,VLD,q_go,"We go,"
1246,VLD_se0_ag4_f_01_1.txt,"So when she decided she wanted to go to DC, I said,",1216,VLD,q_say,"I said,"
1247,VLD_se0_ag4_f_01_1.txt,"when people see her coming, they say, ugh.",1348,VLD,q_say,"they say,"
1248,VLD_se0_ag4_f_01_1.txt,"and we all, <clears throat> went to",1543,VLD,q_all_zero,"and we all,"
1249,VLD_se0_ag4_f_01_1.txt,"the good master speak to my heart and he say, you need to do this.",1740,VLD,q_say,"and he say,"
1250,VLD_se0_ag4_f_01_1.txt,"And she said,",1802,VLD,q_say,"And she said,"
1251,VLD_se0_ag4_f_01_1.txt,"and I'm thinking, Lord, Lord, Lord, Lord.",1968,VLD,q_think,"and I'm thinking,"
1252,VLD_se0_ag4_f_01_1.txt,"And I told him, I said, okay, I'm not gonna leave right now. We gonna",1988,VLD,q_say,"I said,"
1253,VLD_se0_ag4_f_01_1.txt,"And I told him, I said, okay, I'm not gonna leave right now. We gonna",1988,VLD,q_tell,"And I told him,"
1254,VLD_se0_ag4_f_01_1.txt,"Then I'm thinking, did",2012,VLD,q_think,"I'm thinking,"
1255,VLD_se0_ag4_f_01_1.txt,"the mentally challenged. So that's why we say, you know,",2269,VLD,q_say,"we say,"
1256,VLD_se0_ag3_f_02_1.txt,probably twenty-four hours I think- I don't- I don't think it lasted much longer than that.,944,VLD,q_think,I think-
1257,VLD_se0_ag3_f_02_1.txt,"Yeah. I think, um,",1563,VLD,q_think,"I think,"
1258,VLD_se0_ag3_f_02_1.txt,"and doing all of those things. So let's talk about high school a little bit, cause I think-",1586,VLD,q_think,I think-
1259,VLD_se0_ag3_f_02_1.txt,"A lot of what we learned, I think, honestly, we've carried into adulthood.",1824,VLD,q_think,"I think,"
1260,VLD_se0_ag3_m_02_1.txt,I was going-,678,VLD,q_go,I was going-
1261,VLD_se0_ag2_f_01_1.txt,"her daughter, and the next door beside her was, I think, her cousins.",117,VLD,q_think,"I think,"
1262,VLD_se0_ag2_f_01_1.txt,"and my brother and sister, they left me and it was- I was like, wait for me and they up there laughing. But",206,VLD,q_like_copula,"I was like,"
1263,VLD_se0_ag2_f_01_1.txt,"I had my moments where it's like- I was like, she's here and",257,VLD,q_like_copula,"I was like,"
1264,VLD_se0_ag2_f_01_1.txt,"after I went- left /RD-SCHOOL-2/,",431,VLD,q_go,I went-
1265,VLD_se0_ag2_f_01_1.txt,"I said,",703,VLD,q_say,"I said,"
1266,VLD_se0_ag2_f_01_1.txt,"And I'm like,",975,VLD,q_like_contracted,"And I'm like,"
1267,VLD_se0_ag2_f_01_1.txt,"and I just started playing a song. And my band director came up to me and he was like, what are you playing?",995,VLD,q_like_copula,"and he was like,"
1268,VLD_se0_ag2_f_01_1.txt,"I said, I don't know.",997,VLD,q_say,"I said,"
1269,VLD_se0_ag2_f_01_1.txt,"He was like, that sounds really good.",999,VLD,q_like_copula,"He was like,"
1270,VLD_se0_ag2_f_01_1.txt,"(laughing) And I'm like,",1001,VLD,q_like_contracted,"And I'm like,"
1271,VLD_se0_ag2_f_01_1.txt,"he was like,",1007,VLD,q_like_copula,"he was like,"
1272,VLD_se0_ag2_f_01_1.txt,"do you know the notes that you're playing? I said, no sir. And he was like,",1009,VLD,q_say,"I said,"
1273,VLD_se0_ag2_f_01_1.txt,"do you know the notes that you're playing? I said, no sir. And he was like,",1009,VLD,q_like_copula,"And he was like,"
1274,VLD_se0_ag2_f_01_1.txt,"heard about that she was like, I'm putting you in piano lessons,",1024,VLD,q_like_copula,"she was like,"
1275,VLD_se0_ag2_f_01_1.txt,"gospel song, and her fingers was just going. I'm like, oh my God this woman is amazing.",1055,VLD,q_like_contracted,"I'm like,"
1276,VLD_se0_ag2_f_01_1.txt,"I was like, I don't want my virginity taken. (laughing)",1236,VLD,q_like_copula,"I was like,"
1277,VLD_se0_ag2_f_01_1.txt,"and if you poke this. And I was like, oh my God, like. <laugh>",1246,VLD,q_like_copula,"And I was like,"
1278,VLD_se0_ag2_f_01_1.txt,"I remember that til this day and I'm like,",1248,VLD,q_like_contracted,"and I'm like,"
1279,VLD_se0_ag2_f_01_1.txt,"She was like, oh, you're getting a little fat. <laugh> You know, but I didn't take it serious cause she's-",1535,VLD,q_like_copula,"She was like,"
1280,VLD_se0_ag2_f_01_1.txt,"they was like, okay we'll help you out with this. We're gonna-",1773,VLD,q_like_copula,"they was like,"
1281,VLD_se0_ag2_f_01_1.txt,"Can you please help me? And I'm like, what's going on?",2011,VLD,q_like_contracted,"And I'm like,"
1282,VLD_se0_ag2_f_01_1.txt,"He was like, he did it again, he did it again.",2013,VLD,q_like_copula,"He was like,"
1283,VLD_se0_ag2_f_01_1.txt,and I think- I think it's part of-,2373,VLD,q_think,and I think-
1284,VLD_se0_ag2_f_01_1.txt,"<ts> I think,",2537,VLD,q_think,"I think,"
1285,VLD_se0_ag2_f_01_1.txt,"And so I think, ultimately,",2652,VLD,q_think,"I think,"
1286,VLD_se0_ag2_f_01_1.txt,"the doctors was- wa- rushing in, and they was like, we gotta get her temp down because something",2988,VLD,q_like_copula,"and they was like,"
1287,VLD_se0_ag2_f_01_1.txt,"she said, girl you almost died on us, you know, and",3004,VLD,q_say,"she said,"
1288,VLD_se0_ag2_m_01_1.txt,"They were like- Okay, for the most part,",140,VLD,q_like_copula,They were like-
1289,VLD_se0_ag2_m_01_1.txt,"I think like, the rent got too high or something like that. And my mom was like, we can't really s- keep paying this.",625,VLD,q_think,"I think like,"
1290,VLD_se0_ag2_m_01_1.txt,"I don't know, no, I was like, No, leave it alone. I'm not, I'm not just gonna leave it alone.",1229,VLD,q_like_copula,"I was like,"
1291,VLD_se0_ag2_m_01_1.txt,"[Yeah.] Reconnect. I was like, shoot, that's lit cause I don't know nobody else here dude.",1301,VLD,q_like_copula,"I was like,"
1292,VLD_se0_ag2_m_01_1.txt,"We always- cause we alway- you know you have the teachers, they be like, alright, so, we gonna work in partners.",1337,VLD,q_like_copula,"they be like,"
1293,VLD_se0_ag2_m_01_1.txt,"She was like, look. You gotta- you gotta pick the grades up before",1405,VLD,q_like_copula,"She was like,"
1294,VLD_se0_ag2_m_01_1.txt,"<laugh> I was like, aye. your ID.",1888,VLD,q_like_copula,"I was like,"
1295,VLD_se0_ag2_m_01_1.txt,"And I was like,",1983,VLD,q_like_copula,"And I was like,"
1296,VLD_se0_ag2_m_01_1.txt,"but I wasn't thinking I'd been nineteen, getting a little brother, little sis- I be like, it's kind of like now, you know what I mean, like.",1987,VLD,q_like_copula,"I be like,"
1297,VLD_se0_ag2_m_01_1.txt,They like- s- I guess I'm kind of the one of the type that,2097,VLD,q_like_zero,They like-
1298,VLD_se0_ag2_m_01_1.txt,"Like, I'm like, eh,",2411,VLD,q_like_contracted,"I'm like,"
1299,VLD_se0_ag2_m_01_1.txt,"And like, one of them, he in the NFL now, and I remember his- he like, I seen him multiple- a lot actually.",2459,VLD,q_like_zero,"he like,"
1300,VLD_se0_ag2_m_01_1.txt,"I think- I think especially now, it's just so-",2506,VLD,q_think,I think-
1301,VLD_se0_ag2_m_01_1.txt,"I l- like, I said, I like contact.",2577,VLD,q_say,"I said,"
1302,VLD_se0_ag2_m_01_1.txt,"So, I'm telling them,",2816,VLD,q_tell,"I'm telling them,"
1303,VLD_se0_ag2_m_01_1.txt,"And, I'm like, woah.",2884,VLD,q_like_contracted,"I'm like,"
1304,VLD_se0_ag2_m_01_1.txt,"And when they went, I guess like.",2963,VLD,q_go,"they went,"
1305,VLD_se0_ag2_m_01_1.txt,"and I'm like,",3046,VLD,q_like_contracted,"and I'm like,"
1306,VLD_se0_ag2_m_01_1.txt,"I grow my hair because one, I was like, you know growing up black, you d- we always keep your hair cut.",3193,VLD,q_like_copula,"I was like,"
1307,VLD_se0_ag2_m_01_1.txt,"Oh, I thought you said Monday. I was like, oh okay. That- that's soon.",3235,VLD,q_like_copula,"I was like,"
1308,VLD_se0_ag2_f_02_1.txt,"[She's like, what are we talking about again?]",29,VLD,q_like_contracted,"She's like,"
1309,VLD_se0_ag2_f_02_1.txt,I went-,75,VLD,q_go,I went-
1310,VLD_se0_ag2_f_02_1.txt,"I went- I wanna say around kindergarten,",83,VLD,q_go,I went-
1311,VLD_se0_ag2_f_02_1.txt,"I was crying, boo-hoo crying when we moved to the county, and I- my mom was like, y'all have to go to /RD-SCHOOL-1/. I was like,",132,VLD,q_like_copula,"I was like,"
1312,VLD_se0_ag2_f_02_1.txt,"we were like, both- me and /RD-NAME-2/, we were both",136,VLD,q_like_copula,"we were like,"
1313,VLD_se0_ag2_f_02_1.txt,"like, really sad. We was like, we don't wanna go to that school.",138,VLD,q_like_copula,"We was like,"
1314,VLD_se0_ag2_f_02_1.txt,"well he hasn't been hauling oil for years, but he's been in the truck driving business since I was like, a little girl.",237,VLD,q_like_copula,"I was like,"
1315,VLD_se0_ag2_f_02_1.txt,"I was like, how? She said some- I don't know. I don't know how we got it back honestly, but",737,VLD,q_like_copula,"I was like,"
1316,VLD_se0_ag2_f_02_1.txt,"[I was probably] just- I was like, I don't wanna be at this school, it's a lame school, but.",897,VLD,q_like_copula,"I was like,"
1317,VLD_se0_ag2_f_02_1.txt,"I was like, see we- we better than y'all at /RD-NAME-3/. <laugh>",902,VLD,q_like_copula,"I was like,"
1318,VLD_se0_ag2_f_02_1.txt,"[Let's go] back to sixth grade real quick, cause [I think- I]",903,VLD,q_think,I think-
1319,VLD_se0_ag2_f_02_1.txt,"I was like, my brother plays trombone, can I play trombone?",912,VLD,q_like_copula,"I was like,"
1320,VLD_se0_ag2_f_02_1.txt,"And they was like, just putting me on all these different instruments. They had me try the tuba,",914,VLD,q_like_copula,"And they was like,"
1321,VLD_se0_ag2_f_02_1.txt,"Cause I was like, one of the top",961,VLD,q_like_copula,"I was like,"
1322,VLD_se0_ag2_f_02_1.txt,"that's why I was like, I'm'a come in here and I'm'a",985,VLD,q_like_copula,"I was like,"
1323,VLD_se0_ag2_f_02_1.txt,"I was like, I'm ready to be a senior, I don't wanna be",1149,VLD,q_like_copula,"I was like,"
1324,VLD_se0_ag2_f_02_1.txt,"we go to lunch of course, wherever. And I think,",1202,VLD,q_think,"And I think,"
1325,VLD_se0_ag2_f_02_1.txt,"I think I was like, eighty or seventy, or something.",1268,VLD,q_like_copula,"I was like,"
1326,VLD_se0_ag2_f_02_1.txt,"it was nerve-wracking as a freshman cause I'm like, okay",1355,VLD,q_like_contracted,"I'm like,"
1327,VLD_se0_ag2_f_02_1.txt,"[And I was like,]",1395,VLD,q_like_copula,"And I was like,"
1328,VLD_se0_ag2_f_02_1.txt,"I bet he was like, this girl don't know nothing. I was- I really just tried out just so I could get section leader [though.]",1456,VLD,q_like_copula,"he was like,"
1329,VLD_se0_ag2_f_02_1.txt,cause I think-,1657,VLD,q_think,I think-
1330,VLD_se0_ag2_f_02_1.txt,"I did. I was like,",1717,VLD,q_like_copula,"I was like,"
1331,VLD_se0_ag2_f_02_1.txt,"so I was like,",1817,VLD,q_like_copula,"I was like,"
1332,VLD_se0_ag2_f_02_1.txt,"so I was like, yeah let me-",1831,VLD,q_like_copula,"I was like,"
1333,VLD_se0_ag2_f_02_1.txt,"I don't- I don't know. I really love taking pictures but I also love film and stuff, so I'm thinking-",1881,VLD,q_think,I'm thinking-
1334,VLD_se0_ag2_f_02_1.txt,"I don't even- I can't even dance. She said, you can dance. I'm like, no I cannot.",2040,VLD,q_say,"She said,"
1335,VLD_se0_ag2_f_02_1.txt,"I don't even- I can't even dance. She said, you can dance. I'm like, no I cannot.",2040,VLD,q_like_contracted,"I'm like,"
1336,VLD_se0_ag2_f_02_1.txt,"we were like, searching for churches so we were going all around",2084,VLD,q_like_copula,"we were like,"
1337,VLD_se0_ag2_f_02_1.txt,"and stuff. And then we like,",2086,VLD,q_like_zero,"we like,"
1338,VLD_se0_ag2_f_02_1.txt,"So we were like, let's go to this church. And we liked it because Pastor /RD-NAME-3/ was like,",2092,VLD,q_like_copula,"we were like,"
1339,VLD_se0_ag2_f_02_1.txt,"I think I saw that was to it, I was like, I ain't wanna do it. <laugh>",2171,VLD,q_like_copula,"I was like,"
1340,VLD_se0_ag2_f_02_1.txt,"at the time I was like,",2193,VLD,q_like_copula,"I was like,"
1341,VLD_se0_ag2_f_02_1.txt,"But I was like,",2199,VLD,q_like_copula,"I was like,"
1342,VLD_se0_ag2_f_02_1.txt,"he was telling her, her voice was aggravating and stuff.",2302,VLD,q_tell,"he was telling her,"
1343,VLD_se0_ag2_f_02_1.txt,"So I was like, oh my gosh Simon. Oh.",2304,VLD,q_like_copula,"I was like,"
1344,VLD_se0_ag2_f_02_1.txt,"I was like,",2428,VLD,q_like_copula,"I was like,"
1345,VLD_se0_ag2_f_02_1.txt,"and she was like, hi would you like to- would you be interested in working",2436,VLD,q_like_copula,"and she was like,"
1346,VLD_se0_ag2_f_02_1.txt,"I was like,",2440,VLD,q_like_copula,"I was like,"
1347,VLD_se0_ag2_f_02_1.txt,"But she was like,",2444,VLD,q_like_copula,"she was like,"
1348,VLD_se0_ag2_f_02_1.txt,"I was like,",2448,VLD,q_like_copula,"I was like,"
1349,VLD_se0_ag2_f_02_1.txt,"And, I mean, there was a pay raise so I was like, sure.",2454,VLD,q_like_copula,"I was like,"
1350,VLD_se0_ag2_f_02_1.txt,"got me on there. She had been like, scouting me the whole time and looking at me and like,",2458,VLD,q_like_copula,"She had been like,"
1351,VLD_se0_ag2_f_02_1.txt,"So she was like,",2462,VLD,q_like_copula,"she was like,"
1352,VLD_se0_ag2_f_02_1.txt,"And she was like, and she's black, so.",2466,VLD,q_like_copula,"And she was like,"
1353,VLD_se0_ag2_f_02_1.txt,"I was like, really saddened.",2650,VLD,q_like_copula,"I was like,"
1354,VLD_se0_ag2_f_02_1.txt,"[I was like, oh my gosh.]",2654,VLD,q_like_copula,"I was like,"
1355,DCB_se3_ag2_f_01_1.txt,"my dad and my mom were sitting there and she was like,",375,DCB,q_like_copula,"and she was like,"
1356,DCB_se3_ag2_f_01_1.txt,"and so hearing her talk about it I was like, oh like,",1115,DCB,q_like_copula,"I was like,"
1357,DCB_se3_ag2_f_01_1.txt,"And so I took the Intro to Linguistics class, and I was like, I'm doing really well here. Like I can really do this.",1131,DCB,q_like_copula,"and I was like,"
1358,DCB_se3_ag2_f_01_1.txt,I'm like- I think I'm a way better RA just because,1341,DCB,q_like_contracted,I'm like-
1359,DCB_se3_ag2_f_01_1.txt,"He didn't check to see if /RD-SCHOOL-2/ was doing his homework, and he was like, failing school when I met",1895,DCB,q_like_copula,"and he was like,"
1360,DCB_se3_ag2_f_01_1.txt,"<ts> And then his mom died when he was like, in his twenties and",1945,DCB,q_like_copula,"he was like,"
1361,DCB_se3_ag2_f_01_1.txt,"the fact that he's like,",1981,DCB,q_like_contracted,"he's like,"
1362,DCB_se3_ag2_f_01_1.txt,"he's like,",1997,DCB,q_like_contracted,"he's like,"
1363,DCB_se3_ag2_f_01_1.txt,"But I think like,",2001,DCB,q_think,"I think like,"
1364,DCB_se3_ag2_f_01_1.txt,"And she's like,",2115,DCB,q_like_contracted,"And she's like,"
1365,DCB_se3_ag2_f_01_1.txt,"out of my sister and I, I guess I'm like-",2301,DCB,q_like_contracted,I'm like-
1366,DCB_se3_ag2_f_01_1.txt,"I guess I'm like,",2311,DCB,q_like_contracted,"I'm like,"
1367,DCB_se3_ag2_f_01_1.txt,"And how did Dad feel about that? He was like, mm?",2354,DCB,q_like_copula,"He was like,"
1368,DCB_se3_ag2_f_01_1.txt,"Yeah my [dad, he's so fake. He's like, I wanna go with the house. Like whatever you all want to eat]",2355,DCB,q_like_contracted,"He's like,"
1369,DCB_se3_ag2_f_01_1.txt,"So he'll be like, oh yeah, like I'll go wherever you guys wanna go. And then when we tell him,",2381,DCB,q_tell,"we tell him,"
1370,DCB_se3_ag2_f_01_1.txt,"he's like, no I don't really wanna do that,",2383,DCB,q_like_contracted,"he's like,"
1371,DCB_se3_ag2_f_01_1.txt,"And he's like,",2425,DCB,q_like_contracted,"And he's like,"
1372,DCB_se3_ag2_f_01_1.txt,"I'm like, okay yeah, sounds good.",2578,DCB,q_like_contracted,"I'm like,"
1373,DCB_se3_ag2_f_01_1.txt,"So I went,",2608,DCB,q_go,"I went,"
1374,DCB_se3_ag2_f_01_1.txt,"and I was like, I'm not having fun.",2610,DCB,q_like_copula,"and I was like,"
1375,DCB_se3_ag2_f_01_1.txt,I just think I'm like-,2870,DCB,q_like_contracted,I'm like-
1376,DCB_se1_ag2_m_02_1.txt,"And you be like, uh, I can't believe this. And I be like, kill moe. That's crazy.",655,DCB,q_like_copula,"And I be like,"
1377,DCB_se1_ag2_m_02_1.txt,we all- that's how,899,DCB,q_all_zero,we all-
1378,DCB_se2_ag2_m_01_1.txt,we- we- we all- It's a group us. It's-,341,DCB,q_all_zero,we all-
1379,DCB_se2_ag2_m_01_1.txt,"Like, we- we all- we love each other so much. Like, it's-",704,DCB,q_all_zero,we all-
1380,DCB_se2_ag2_m_01_1.txt,"So I begged my mom. I said, mom, please don't- Please let me go back to school cause I wanna play on the basketball team. She would not let me go.",854,DCB,q_say,"I said,"
1381,DCB_se2_ag2_m_01_1.txt,"So she said, okay, I'm'a- I'm'a take you away from your friends,",856,DCB,q_say,"she said,"
1382,DCB_se2_ag2_m_01_1.txt,"So she said, okay, I'm'a take you away from your friends, and I went to /RD-SCHOOL-3/.",862,DCB,q_say,"she said,"
1383,DCB_se2_ag2_m_01_1.txt,"So when I first got there, I said-",892,DCB,q_say,I said-
1384,DCB_se2_ag2_m_01_1.txt,"I said, okay Mom, where's the school?",894,DCB,q_say,"I said,"
1385,DCB_se2_ag2_m_01_1.txt,"And she said, this is it. I said- I thought it was the place where you go to sign up to go [to the school.]",896,DCB,q_say,"And she said,"
1385,DCB_se2_ag2_m_01_1.txt,"And she said, this is it. I said- I thought it was the place where you go to sign up to go [to the school.]",896,DCB,q_say,I said-
1386,DCB_se2_ag2_m_01_1.txt,So I said-,898,DCB,q_say,I said-
1387,DCB_se2_ag2_m_01_1.txt,"I said, ma, I said, what is this? So, the hallways I could literally touch",900,DCB,q_say,"I said,"
1387,DCB_se2_ag2_m_01_1.txt,"I said, ma, I said, what is this? So, the hallways I could literally touch",900,DCB,q_say,"I said,"
1388,DCB_se2_ag2_m_01_1.txt,"with- with their dog, and I said, what is this? I said, that is crazy.",982,DCB,q_say,"and I said,"
1388,DCB_se2_ag2_m_01_1.txt,"with- with their dog, and I said, what is this? I said, that is crazy.",982,DCB,q_say,"I said,"
1389,DCB_se2_ag2_m_01_1.txt,"And sometimes I aks the adults, I say, how do y'all-",1074,DCB,q_say,"I say,"
1390,DCB_se2_ag2_m_01_1.txt,I think- I think progress is always good.,1099,DCB,q_think,I think-
1391,DCB_se2_ag2_m_01_1.txt,"um, in the- during the summer time. So I said, that's cool.",1168,DCB,q_say,"I said,"
1392,DCB_se2_ag2_m_01_1.txt,"cause I'm like, okay. I already left DC where that- that is going on. I don't wanna deal with this anymore.",1222,DCB,q_like_contracted,"I'm like,"
1393,DCB_se2_ag2_m_01_1.txt,"So I said, okay, I wanna go here. So I applied, and I got accepted, and then I went to /RD-SCHOOL-2/.",1257,DCB,q_say,"I said,"
1394,DCB_se2_ag2_m_01_1.txt,"he said, What are those? I said, Uh, these are New Balance. These are nine nine- I think at the time it was nine nine o-",1378,DCB,q_say,"he said,"
1394,DCB_se2_ag2_m_01_1.txt,"he said, What are those? I said, Uh, these are New Balance. These are nine nine- I think at the time it was nine nine o-",1378,DCB,q_say,"I said,"
1395,DCB_se2_ag2_m_01_1.txt,"And, I said, These nine nine ones.",1382,DCB,q_say,"I said,"
1396,DCB_se2_ag2_m_01_1.txt,"And he said, You got on old people shoes?",1384,DCB,q_say,"And he said,"
1397,DCB_se2_ag2_m_01_1.txt,"And I said, No. I said, These are- I said, These are nine nine ones. I said, Do you know how much these cost?",1386,DCB,q_say,"And I said,"
1397,DCB_se2_ag2_m_01_1.txt,"And I said, No. I said, These are- I said, These are nine nine ones. I said, Do you know how much these cost?",1386,DCB,q_say,"I said,"
